    1 0.000000000     10.0.0.1 → 10.0.0.2     TCP 76 58510 → 80 [SYN] Seq=0 Win=64240 Len=0 MSS=1460 SACK_PERM=1 TSval=138668302 TSecr=0 WS=128
    2 0.001980626     10.0.0.2 → 10.0.0.1     TCP 76 80 → 58510 [SYN, ACK] Seq=0 Ack=1 Win=65160 Len=0 MSS=1460 SACK_PERM=1 TSval=2378174521 TSecr=138668302 WS=128
    3 0.002029248     10.0.0.1 → 10.0.0.2     TCP 68 58510 → 80 [ACK] Seq=1 Ack=1 Win=64256 Len=0 TSval=138668304 TSecr=2378174521
    4 0.002314799     10.0.0.1 → 10.0.0.2     HTTP 140 GET / HTTP/1.1 
    5 0.003853479     10.0.0.2 → 10.0.0.1     TCP 68 80 → 58510 [ACK] Seq=1 Ack=73 Win=65152 Len=0 TSval=2378174523 TSecr=138668304
    6 0.003956281     10.0.0.2 → 10.0.0.1     HTTP 297 HTTP/1.1 200 OK  (text/html)
    7 0.003970036     10.0.0.1 → 10.0.0.2     TCP 68 58510 → 80 [ACK] Seq=73 Ack=230 Win=64128 Len=0 TSval=138668306 TSecr=2378174524
    8 0.006236213     10.0.0.1 → 10.0.0.2     TCP 68 58510 → 80 [FIN, ACK] Seq=73 Ack=230 Win=64128 Len=0 TSval=138668308 TSecr=2378174524
    9 0.007705451     10.0.0.2 → 10.0.0.1     TCP 68 80 → 58510 [FIN, ACK] Seq=230 Ack=74 Win=65152 Len=0 TSval=2378174527 TSecr=138668308
   10 0.007729014     10.0.0.1 → 10.0.0.2     TCP 68 58510 → 80 [ACK] Seq=74 Ack=231 Win=64128 Len=0 TSval=138668310 TSecr=2378174527
   11 5.153409004 PcsCompu_26:b4:da →              ARP 62 Who has 10.0.0.1? Tell 10.0.0.2
   12 5.153440552 PcsCompu_7a:bf:84 →              ARP 44 10.0.0.1 is at 08:00:27:7a:bf:84
   13 5.196511708 PcsCompu_7a:bf:84 →              ARP 44 Who has 10.0.0.2? Tell 10.0.0.1
   14 5.196913519 PcsCompu_26:b4:da →              ARP 62 10.0.0.2 is at 08:00:27:26:b4:da
