    1 0.000000000     10.0.0.1 → 10.0.0.2     TCP 76 57258 → 443 [SYN] Seq=0 Win=64240 Len=0 MSS=1460 SACK_PERM=1 TSval=139482548 TSecr=0 WS=128
    2 0.001779013     10.0.0.2 → 10.0.0.1     TCP 76 443 → 57258 [SYN, ACK] Seq=0 Ack=1 Win=65160 Len=0 MSS=1460 SACK_PERM=1 TSval=2378988767 TSecr=139482548 WS=128
    3 0.001825743     10.0.0.1 → 10.0.0.2     TCP 68 57258 → 443 [ACK] Seq=1 Ack=1 Win=64256 Len=0 TSval=139482550 TSecr=2378988767
    4 0.002029068     10.0.0.1 → 10.0.0.2     HTTP 144 GET / HTTP/1.1 
    5 0.003467620     10.0.0.2 → 10.0.0.1     TCP 68 443 → 57258 [ACK] Seq=1 Ack=77 Win=65152 Len=0 TSval=2378988769 TSecr=139482550
    6 0.003576166     10.0.0.2 → 10.0.0.1     HTTP 297 HTTP/1.1 200 OK  (text/html)
    7 0.003590612     10.0.0.1 → 10.0.0.2     TCP 68 57258 → 443 [ACK] Seq=77 Ack=230 Win=64128 Len=0 TSval=139482551 TSecr=2378988769
    8 0.005554984     10.0.0.1 → 10.0.0.2     TCP 68 57258 → 443 [FIN, ACK] Seq=77 Ack=230 Win=64128 Len=0 TSval=139482553 TSecr=2378988769
    9 0.007023916     10.0.0.2 → 10.0.0.1     TCP 68 443 → 57258 [FIN, ACK] Seq=230 Ack=78 Win=65152 Len=0 TSval=2378988772 TSecr=139482553
   10 0.007047179     10.0.0.1 → 10.0.0.2     TCP 68 57258 → 443 [ACK] Seq=78 Ack=231 Win=64128 Len=0 TSval=139482555 TSecr=2378988772
   11 5.030744434 PcsCompu_7a:bf:84 →              ARP 44 Who has 10.0.0.2? Tell 10.0.0.1
   12 5.031685980 PcsCompu_26:b4:da →              ARP 62 10.0.0.2 is at 08:00:27:26:b4:da
   13 5.200884795 PcsCompu_26:b4:da →              ARP 62 Who has 10.0.0.1? Tell 10.0.0.2
   14 5.200916255 PcsCompu_7a:bf:84 →              ARP 44 10.0.0.1 is at 08:00:27:7a:bf:84
