    1 0.000000000     10.0.0.1 → 10.0.0.2     TCP 76 58510 → 80 [SYN] Seq=0 Win=64240 Len=0 MSS=1460 SACK_PERM=1 TSval=138668302 TSecr=0 WS=128
    2 0.000074173     10.0.1.2 → 10.0.1.1     TCP 76 58510 → 80 [SYN] Seq=0 Win=64240 Len=0 MSS=1460 SACK_PERM=1 TSval=138668302 TSecr=0 WS=128
    3 0.001074692     10.0.1.1 → 10.0.1.2     TCP 76 80 → 58510 [SYN, ACK] Seq=0 Ack=1 Win=65160 Len=0 MSS=1460 SACK_PERM=1 TSval=2378174521 TSecr=138668302 WS=128
    4 0.001107830     10.0.0.2 → 10.0.0.1     TCP 76 80 → 58510 [SYN, ACK] Seq=0 Ack=1 Win=65160 Len=0 MSS=1460 SACK_PERM=1 TSval=2378174521 TSecr=138668302 WS=128
    5 0.001898097     10.0.0.1 → 10.0.0.2     TCP 68 58510 → 80 [ACK] Seq=1 Ack=1 Win=64256 Len=0 TSval=138668304 TSecr=2378174521
    6 0.001934377     10.0.1.2 → 10.0.1.1     TCP 68 58510 → 80 [ACK] Seq=1 Ack=1 Win=64256 Len=0 TSval=138668304 TSecr=2378174521
    7 0.002238003     10.0.0.1 → 10.0.0.2     HTTP 140 GET / HTTP/1.1 
    8 0.002259399     10.0.1.2 → 10.0.1.1     HTTP 140 GET / HTTP/1.1 
    9 0.002960067     10.0.1.1 → 10.0.1.2     TCP 68 80 → 58510 [ACK] Seq=1 Ack=73 Win=65152 Len=0 TSval=2378174523 TSecr=138668304
   10 0.002990171     10.0.0.2 → 10.0.0.1     TCP 68 80 → 58510 [ACK] Seq=1 Ack=73 Win=65152 Len=0 TSval=2378174523 TSecr=138668304
   11 0.003253036     10.0.1.1 → 10.0.1.2     HTTP 297 HTTP/1.1 200 OK  (text/html)
   12 0.003271940     10.0.0.2 → 10.0.0.1     HTTP 297 HTTP/1.1 200 OK  (text/html)
   13 0.003928885     10.0.0.1 → 10.0.0.2     TCP 68 58510 → 80 [ACK] Seq=73 Ack=230 Win=64128 Len=0 TSval=138668306 TSecr=2378174524
   14 0.003958801     10.0.1.2 → 10.0.1.1     TCP 68 58510 → 80 [ACK] Seq=73 Ack=230 Win=64128 Len=0 TSval=138668306 TSecr=2378174524
   15 0.006069747     10.0.0.1 → 10.0.0.2     TCP 68 58510 → 80 [FIN, ACK] Seq=73 Ack=230 Win=64128 Len=0 TSval=138668308 TSecr=2378174524
   16 0.006097066     10.0.1.2 → 10.0.1.1     TCP 68 58510 → 80 [FIN, ACK] Seq=73 Ack=230 Win=64128 Len=0 TSval=138668308 TSecr=2378174524
   17 0.006945482     10.0.1.1 → 10.0.1.2     TCP 68 80 → 58510 [FIN, ACK] Seq=230 Ack=74 Win=65152 Len=0 TSval=2378174527 TSecr=138668308
   18 0.006972623     10.0.0.2 → 10.0.0.1     TCP 68 80 → 58510 [FIN, ACK] Seq=230 Ack=74 Win=65152 Len=0 TSval=2378174527 TSecr=138668308
   19 0.007618335     10.0.0.1 → 10.0.0.2     TCP 68 58510 → 80 [ACK] Seq=74 Ack=231 Win=64128 Len=0 TSval=138668310 TSecr=2378174527
   20 0.007645636     10.0.1.2 → 10.0.1.1     TCP 68 58510 → 80 [ACK] Seq=74 Ack=231 Win=64128 Len=0 TSval=138668310 TSecr=2378174527
