    1 0.000000000     10.0.0.1 → 10.0.0.2     TCP 76 57258 → 443 [SYN] Seq=0 Win=64240 Len=0 MSS=1460 SACK_PERM=1 TSval=139482548 TSecr=0 WS=128
    2 0.000057630     10.0.1.2 → 10.0.1.1     TCP 76 57258 → 443 [SYN] Seq=0 Win=64240 Len=0 MSS=1460 SACK_PERM=1 TSval=139482548 TSecr=0 WS=128
    3 0.000856619     10.0.1.1 → 10.0.1.2     TCP 76 443 → 57258 [SYN, ACK] Seq=0 Ack=1 Win=65160 Len=0 MSS=1460 SACK_PERM=1 TSval=2378988767 TSecr=139482548 WS=128
    4 0.000887545     10.0.0.2 → 10.0.0.1     TCP 76 443 → 57258 [SYN, ACK] Seq=0 Ack=1 Win=65160 Len=0 MSS=1460 SACK_PERM=1 TSval=2378988767 TSecr=139482548 WS=128
    5 0.001762348     10.0.0.1 → 10.0.0.2     TCP 68 57258 → 443 [ACK] Seq=1 Ack=1 Win=64256 Len=0 TSval=139482550 TSecr=2378988767
    6 0.001762694     10.0.0.1 → 10.0.0.2     HTTP 144 GET / HTTP/1.1 
    7 0.001792328     10.0.1.2 → 10.0.1.1     TCP 68 57258 → 443 [ACK] Seq=1 Ack=1 Win=64256 Len=0 TSval=139482550 TSecr=2378988767
    8 0.001826640     10.0.1.2 → 10.0.1.1     HTTP 144 GET / HTTP/1.1 
    9 0.002555048     10.0.1.1 → 10.0.1.2     TCP 68 443 → 57258 [ACK] Seq=1 Ack=77 Win=65152 Len=0 TSval=2378988769 TSecr=139482550
   10 0.002582385     10.0.0.2 → 10.0.0.1     TCP 68 443 → 57258 [ACK] Seq=1 Ack=77 Win=65152 Len=0 TSval=2378988769 TSecr=139482550
   11 0.002867668     10.0.1.1 → 10.0.1.2     HTTP 297 HTTP/1.1 200 OK  (text/html)
   12 0.002889033     10.0.0.2 → 10.0.0.1     HTTP 297 HTTP/1.1 200 OK  (text/html)
   13 0.003327936     10.0.0.1 → 10.0.0.2     TCP 68 57258 → 443 [ACK] Seq=77 Ack=230 Win=64128 Len=0 TSval=139482551 TSecr=2378988769
   14 0.003345591     10.0.1.2 → 10.0.1.1     TCP 68 57258 → 443 [ACK] Seq=77 Ack=230 Win=64128 Len=0 TSval=139482551 TSecr=2378988769
   15 0.005463555     10.0.0.1 → 10.0.0.2     TCP 68 57258 → 443 [FIN, ACK] Seq=77 Ack=230 Win=64128 Len=0 TSval=139482553 TSecr=2378988769
   16 0.005491709     10.0.1.2 → 10.0.1.1     TCP 68 57258 → 443 [FIN, ACK] Seq=77 Ack=230 Win=64128 Len=0 TSval=139482553 TSecr=2378988769
   17 0.006269022     10.0.1.1 → 10.0.1.2     TCP 68 443 → 57258 [FIN, ACK] Seq=230 Ack=78 Win=65152 Len=0 TSval=2378988772 TSecr=139482553
   18 0.006296515     10.0.0.2 → 10.0.0.1     TCP 68 443 → 57258 [FIN, ACK] Seq=230 Ack=78 Win=65152 Len=0 TSval=2378988772 TSecr=139482553
   19 0.006902094     10.0.0.1 → 10.0.0.2     TCP 68 57258 → 443 [ACK] Seq=78 Ack=231 Win=64128 Len=0 TSval=139482555 TSecr=2378988772
   20 0.006930070     10.0.1.2 → 10.0.1.1     TCP 68 57258 → 443 [ACK] Seq=78 Ack=231 Win=64128 Len=0 TSval=139482555 TSecr=2378988772
