    1 0.000000000     10.0.1.2 → 10.0.1.1     TCP 76 57258 → 443 [SYN] Seq=0 Win=64240 Len=0 MSS=1460 SACK_PERM=1 TSval=139482548 TSecr=0 WS=128
    2 0.000047825     10.0.1.1 → 10.0.1.2     TCP 76 443 → 57258 [SYN, ACK] Seq=0 Ack=1 Win=65160 Len=0 MSS=1460 SACK_PERM=1 TSval=2378988767 TSecr=139482548 WS=128
    3 0.001743412     10.0.1.2 → 10.0.1.1     TCP 68 57258 → 443 [ACK] Seq=1 Ack=1 Win=64256 Len=0 TSval=139482550 TSecr=2378988767
    4 0.001743768     10.0.1.2 → 10.0.1.1     HTTP 144 GET / HTTP/1.1 
    5 0.001807787     10.0.1.1 → 10.0.1.2     TCP 68 443 → 57258 [ACK] Seq=1 Ack=77 Win=65152 Len=0 TSval=2378988769 TSecr=139482550
    6 0.002130316     10.0.1.1 → 10.0.1.2     HTTP 297 HTTP/1.1 200 OK  (text/html)
    7 0.003255961     10.0.1.2 → 10.0.1.1     TCP 68 57258 → 443 [ACK] Seq=77 Ack=230 Win=64128 Len=0 TSval=139482551 TSecr=2378988769
    8 0.005422201     10.0.1.2 → 10.0.1.1     TCP 68 57258 → 443 [FIN, ACK] Seq=77 Ack=230 Win=64128 Len=0 TSval=139482553 TSecr=2378988769
    9 0.005510665     10.0.1.1 → 10.0.1.2     TCP 68 443 → 57258 [FIN, ACK] Seq=230 Ack=78 Win=65152 Len=0 TSval=2378988772 TSecr=139482553
   10 0.006931588     10.0.1.2 → 10.0.1.1     TCP 68 57258 → 443 [ACK] Seq=78 Ack=231 Win=64128 Len=0 TSval=139482555 TSecr=2378988772
