    1 0.000000000     10.0.1.2 → 10.0.1.1     TCP 76 58510 → 80 [SYN] Seq=0 Win=64240 Len=0 MSS=1460 SACK_PERM=1 TSval=138668302 TSecr=0 WS=128
    2 0.000052558     10.0.1.1 → 10.0.1.2     TCP 76 80 → 58510 [SYN, ACK] Seq=0 Ack=1 Win=65160 Len=0 MSS=1460 SACK_PERM=1 TSval=2378174521 TSecr=138668302 WS=128
    3 0.001740174     10.0.1.2 → 10.0.1.1     TCP 68 58510 → 80 [ACK] Seq=1 Ack=1 Win=64256 Len=0 TSval=138668304 TSecr=2378174521
    4 0.001961940     10.0.1.2 → 10.0.1.1     HTTP 140 GET / HTTP/1.1 
    5 0.001982048     10.0.1.1 → 10.0.1.2     TCP 68 80 → 58510 [ACK] Seq=1 Ack=73 Win=65152 Len=0 TSval=2378174523 TSecr=138668304
    6 0.002252716     10.0.1.1 → 10.0.1.2     HTTP 297 HTTP/1.1 200 OK  (text/html)
    7 0.003771567     10.0.1.2 → 10.0.1.1     TCP 68 58510 → 80 [ACK] Seq=73 Ack=230 Win=64128 Len=0 TSval=138668306 TSecr=2378174524
    8 0.005899830     10.0.1.2 → 10.0.1.1     TCP 68 58510 → 80 [FIN, ACK] Seq=73 Ack=230 Win=64128 Len=0 TSval=138668308 TSecr=2378174524
    9 0.005987881     10.0.1.1 → 10.0.1.2     TCP 68 80 → 58510 [FIN, ACK] Seq=230 Ack=74 Win=65152 Len=0 TSval=2378174527 TSecr=138668308
   10 0.007411466     10.0.1.2 → 10.0.1.1     TCP 68 58510 → 80 [ACK] Seq=74 Ack=231 Win=64128 Len=0 TSval=138668310 TSecr=2378174527
